{"first_sequence":"1","last_sequence":"16","records":[{"correlation":"1","direction":"plugin","payload":{"capabilities":["hunger_games_v1"],"plugin":{"name":"ArenaFoundation","version":"0.1.0"},"server":{"minecraft_version":"26.1.2","name":"Paper","protocol_version":775,"version":"26.1.2-74-e4e17fc (MC: 26.1.2)"}},"protocol":1,"run_id":"match-rules-abort-c751a441-ff94-4513-b924-7487ba3b0a4b","sequence":"2","type":"ready"},{"direction":"runner","payload":{"map_semantic_id":"d500789ba3f338f4eeea771edd96ef948caf87e3d454c5669517e576b8226e3a","mode":"hunger_games","roster":[{"kind":"bot","offline_uuid":"4f09a200-722b-3800-a45e-e2061f874719","participant_id":"seat-0","seat":0,"username":"ArenaBot0"},{"kind":"bot","offline_uuid":"fd3d4f76-4d81-3cb3-9a92-682f3c04f721","participant_id":"seat-1","seat":1,"username":"ArenaBot1"}],"scenario_semantic_id":"78a9701de0ffcecdf4f6467a485353803e1566504b4d31d6a2dc8735ff04c929","seed":"951004","settings":{"border":{"final_diameter_blocks":52,"initial_diameter_blocks":62,"shrink_end_tick":"20","shrink_start_tick":"10"},"match":{"authoritative_max_ticks":"60","block_breaking":false,"block_placing":false,"countdown_ticks":"0","grace_ticks":"0","natural_mobs":false,"natural_random_ticks":false,"respawn":false}}},"protocol":1,"run_id":"match-rules-abort-c751a441-ff94-4513-b924-7487ba3b0a4b","sequence":"2","type":"prepare"},{"correlation":"2","direction":"plugin","payload":{},"protocol":1,"run_id":"match-rules-abort-c751a441-ff94-4513-b924-7487ba3b0a4b","sequence":"3","type":"ack"},{"direction":"plugin","payload":{"border_diameter_blocks":62,"phase":"waiting","tick":null},"protocol":1,"run_id":"match-rules-abort-c751a441-ff94-4513-b924-7487ba3b0a4b","sequence":"4","type":"public_clock"},{"direction":"runner","payload":{},"protocol":1,"run_id":"match-rules-abort-c751a441-ff94-4513-b924-7487ba3b0a4b","sequence":"3","type":"start"},{"correlation":"3","direction":"plugin","payload":{},"protocol":1,"run_id":"match-rules-abort-c751a441-ff94-4513-b924-7487ba3b0a4b","sequence":"6","type":"ack"},{"direction":"plugin","payload":{"border_diameter_blocks":62,"phase":"active","tick":{"domain":"match","value":"0"}},"protocol":1,"run_id":"match-rules-abort-c751a441-ff94-4513-b924-7487ba3b0a4b","sequence":"7","type":"public_clock"},{"direction":"plugin","payload":{"alive_seats":[0,1],"at":{"domain":"match","value":"0"}},"protocol":1,"run_id":"match-rules-abort-c751a441-ff94-4513-b924-7487ba3b0a4b","sequence":"8","type":"public_state"},{"direction":"plugin","payload":{"border_diameter_blocks":62,"phase":"active","tick":{"domain":"match","value":"1"}},"protocol":1,"run_id":"match-rules-abort-c751a441-ff94-4513-b924-7487ba3b0a4b","sequence":"9","type":"public_clock"},{"direction":"plugin","payload":{"border_diameter_blocks":62,"phase":"active","tick":{"domain":"match","value":"2"}},"protocol":1,"run_id":"match-rules-abort-c751a441-ff94-4513-b924-7487ba3b0a4b","sequence":"10","type":"public_clock"},{"direction":"plugin","payload":{"border_diameter_blocks":62,"phase":"active","tick":{"domain":"match","value":"3"}},"protocol":1,"run_id":"match-rules-abort-c751a441-ff94-4513-b924-7487ba3b0a4b","sequence":"11","type":"public_clock"},{"direction":"plugin","payload":{"border_diameter_blocks":62,"phase":"active","tick":{"domain":"match","value":"4"}},"protocol":1,"run_id":"match-rules-abort-c751a441-ff94-4513-b924-7487ba3b0a4b","sequence":"12","type":"public_clock"},{"direction":"runner","payload":{"reason":"operator"},"protocol":1,"run_id":"match-rules-abort-c751a441-ff94-4513-b924-7487ba3b0a4b","sequence":"4","type":"abort"},{"correlation":"4","direction":"plugin","payload":{},"protocol":1,"run_id":"match-rules-abort-c751a441-ff94-4513-b924-7487ba3b0a4b","sequence":"13","type":"ack"},{"direction":"plugin","payload":{"border_diameter_blocks":62,"phase":"aborted","tick":{"domain":"match","value":"4"}},"protocol":1,"run_id":"match-rules-abort-c751a441-ff94-4513-b924-7487ba3b0a4b","sequence":"14","type":"public_clock"},{"direction":"plugin","payload":{"at":{"domain":"match","value":"4"},"kind":"abort","reason":"operator","survivors":[0,1]},"protocol":1,"run_id":"match-rules-abort-c751a441-ff94-4513-b924-7487ba3b0a4b","sequence":"15","type":"outcome"}],"run_id":"match-rules-abort-c751a441-ff94-4513-b924-7487ba3b0a4b","schema":2,"sha256":"5a17f27e1f29f535cd3067e91cc39843ae3bbbdb5bd5f14bd007ac9c29351e7a","trailer":{"complete":true}}